{
  "$schema": "https://json-schema.org/draft/2020-12/schema",
  "title": "Cento Worker Artifact v1",
  "type": "object",
  "required": ["schema_version", "manifest_id", "worker_id", "role", "status", "base_ref", "touched_paths"],
  "properties": {
    "schema_version": {"const": "cento.worker_artifact.v1"},
    "manifest_path": {"type": "string"},
    "manifest_id": {"type": "string"},
    "worker_id": {"type": "string"},
    "worker_type": {"type": "string"},
    "runtime": {"type": "string"},
    "fixture_case": {"type": ["string", "null"]},
    "role": {"type": "string"},
    "status": {"enum": ["completed", "rejected", "failed"]},
    "base_ref": {"type": "string"},
    "artifact_dir": {"type": "string"},
    "patch_file": {"type": ["string", "null"]},
    "patch_path": {"type": ["string", "null"]},
    "patch_bundle": {"type": ["string", "null"]},
    "handoff": {"type": "string"},
    "touched_paths": {"type": "array", "items": {"type": "string"}},
    "owned_paths": {"type": "array", "items": {"type": "string"}},
    "unowned_paths": {"type": "array", "items": {"type": "string"}},
    "protected_paths_touched": {"type": "array", "items": {"type": "string"}},
    "staged_paths": {"type": "array", "items": {"type": "string"}},
    "dirty_owned_paths": {"type": "array", "items": {"type": "string"}},
    "dirty_unrelated_paths": {"type": "array", "items": {"type": "string"}},
    "rejections": {"type": "array", "items": {"type": "string"}},
    "assumptions": {"type": "array", "items": {"type": "string"}},
    "validation": {"type": ["object", "array"]},
    "risks": {"type": "array", "items": {"type": "string"}},
    "warnings": {"type": "array", "items": {"type": "string"}},
    "stdout_path": {"type": ["string", "null"]},
    "stderr_path": {"type": ["string", "null"]},
    "duration_ms": {"type": ["number", "integer", "null"]},
    "runtime_result": {"type": "object"},
    "launch_head": {"type": "string"},
    "worker_head": {"type": "string"},
    "started_at": {"type": "string"},
    "completed_at": {"type": "string"}
  }
}
